Historia medieval de las ciudades europeas,[0.49236596 0.45226702 0.43519414]
Principales destinos turisticos en Europa,[0.47434165 0.4195732  0.41079192]
Influencia de la realeza en la cultura europea,[0.36115756 0.36115756 0.34752402]
Importancia de los parques urbanos en las ciudades,[0.42874646 0.42874646 0.39605902]
Gastronomia tipica en capitales europeas,[0.2847474  0.24659848 0.24659848]
Eventos deportivos iconicos en Europa,[0.40824829 0.35355339 0.35355339]
Celebraciones de Navidad en ciudades europeas,[0.37796447 0.37115374 0.32732684]
Museos de arte importantes en Europa,[0.48564293 0.47583095 0.44861772]
Efectos de la Segunda Guerra Mundial en ciudades europeas,[0.45360921 0.43212081 0.3928371 ]
Arquitectura historica en ciudades europeas,[0.4375    0.4330127 0.375    ]
Clubes de futbol famosos y sus estadios en Europa,[0.45098762 0.39056673 0.39056673]
Transformacion urbana y regeneracion de espacios,[0.55391171 0.52223297 0.48995593]
Tradicion cervecera en ciudades europeas,[0.34320324 0.2941742  0.2941742 ]
Mercados y comercio tradicional en Europa,[0.55117825 0.50524673 0.47733437]
Centros de arte y creatividad en ciudades modernas,[0.61558701 0.59234888 0.56428809]
Actividades de ocio y entretenimiento en ciudades metropolitanas,[0.49518757 0.42884501 0.42884501]
Conservacion de la naturaleza y la vida silvestre en zonas urbanas,[0.4271211  0.41099747 0.36989772]
Planificacion de eventos culturales y festivales en ciudades”,[0.53605627 0.51066218 0.46423835]
Desarrollo del transporte y la infraestructura urbana,[0.58554004 0.50207901 0.47434165]
Impacto de la tecnologia en la vida urbana,[0.58461282 0.51711223 0.50628956]
